{"render_metadata_schema_version":"render-metadata.schema.v1","semantic_profile":"uml","nodes":{"pkg-messaging":{"type":"Package","source_id":"pkg-messaging","properties":{"kind":"package"}},"class-message":{"type":"Class","source_id":"class-message","properties":{"package":"pkg-messaging","attributes":[{"name":"subject","type":"String","visibility":"public","multiplicity":"1"},{"name":"sentOn","type":"Timestamp","visibility":"public","multiplicity":"1"}],"operations":[]}},"class-attachment":{"type":"Class","source_id":"class-attachment","properties":{"package":"pkg-messaging","attributes":[{"name":"filename","type":"String","visibility":"public","multiplicity":"1"},{"name":"sizeBytes","type":"Integer","visibility":"public","multiplicity":"1"}],"operations":[]}}},"edges":{"message-has-attachment":{"type":"Composition","source_id":"message-has-attachment","properties":{"source_role":"message","target_role":"attachment","source_multiplicity":"1","target_multiplicity":"0..*"}}},"groups":{"messaging-boundary":{"type":"Package","source_id":"pkg-messaging"}}}