{
  "render_metadata_schema_version": "render-metadata.schema.v1",
  "semantic_profile": "archimate",
  "nodes": {
    "applicant": {
      "type": "ApplicationComponent",
      "source_id": "applicant"
    },
    "svc-submission": {
      "type": "ApplicationComponent",
      "source_id": "svc-submission"
    }
  },
  "edges": {
    "svc-serves-applicant": {
      "type": "Serving",
      "source_id": "svc-serves-applicant"
    }
  },
  "groups": {}
}
